metric_key,metric_label,unit,round5_applicant,round5_accepted,round6_theil_sen_reference,stretch_scenario,role,warning
company_sales_cagr,全社年平均売上高成長率,%/年,20.0,21.0,22.5,25.0,成長率だけでなく絶対増加額と両立,公式足切りではない。同業・同規模の需要証拠とボトルネック解消ロジックで裏付け、未達リスクを反映する。
company_sales_increase,全社売上高増加額,億円,67.1,82.4,83.525,100.0,全社にとっての成長インパクト,公式足切りではない。同業・同規模の需要証拠とボトルネック解消ロジックで裏付け、未達リスクを反映する。
project_sales_increase,補助事業売上高増加額,億円,57.4,74.8,79.98750000000001,90.0,五回連続で採択者中央値が申請者中央値を上回る,公式足切りではない。同業・同規模の需要証拠とボトルネック解消ロジックで裏付け、未達リスクを反映する。
value_added_increase,補助事業付加価値増加額,億円,19.9,28.1,31.387500000000003,35.0,絶対効果の中核,公式足切りではない。同業・同規模の需要証拠とボトルネック解消ロジックで裏付け、未達リスクを反映する。
employee_pay_rate,年平均従業員目標賃上げ率,%/年,6.5,7.0,7.7250000000000005,7.5,未達返還リスクを考慮し実行可能性を優先,公式足切りではない。同業・同規模の需要証拠とボトルネック解消ロジックで裏付け、未達リスクを反映する。
employee_pay_total_increase,従業員給与支給総額の増加額,億円,2.8,3.9,4.266666666666667,5.0,賃上げ率だけでなく地域に落ちる給与総額,公式足切りではない。同業・同規模の需要証拠とボトルネック解消ロジックで裏付け、未達リスクを反映する。
value_added_subsidy_ratio,補助金額に対する付加価値増加額割合,%,171.0,213.0,237.75,250.0,国費1円当たり効果,公式足切りではない。同業・同規模の需要証拠とボトルネック解消ロジックで裏付け、未達リスクを反映する。
