pair_id,round,focal_company,comparison_company,match_basis,focal_project_cost_oku,comparison_project_cost_oku,focal_subsidy_oku,comparison_subsidy_oku,focal_sales_increase_oku,comparison_sales_increase_oku,focal_sales_cagr_pct,comparison_sales_cagr_pct,focal_labor_productivity_cagr_pct,comparison_labor_productivity_cagr_pct,focal_employee_pay_cagr_pct,comparison_employee_pay_cagr_pct,focal_employees_base,comparison_employees_base,focal_employees_target,comparison_employees_target,focal_payroll_increase_proxy_oku,comparison_payroll_increase_proxy_oku,focal_public_evidence,comparison_public_evidence,manual_interpretation,focal_pdf_url,comparison_pdf_url,review_method
P01,3次,中本Fine Pack株式会社,株式会社PXP,3次・事業費35～37億円・補助金約9.6億円,35,37,9.7,9.6,33.45,235,,,26.8,48,5.5,7.8,64,38,144,66,3.8576,3.7568,大口顧客エフピコからのPET増産要請、PET資源循環、工場集約、物流短縮、自動化を一つの因果鎖として説明。,次世代CIGSタンデム太陽電池の研究開発から量産への移行、世界市場、エネルギー安全保障を結合。,公開数値が相対的に小さくても、実名需要→現状ボトルネック→設備→能力・物流改善が具体的なら通り得る。一方、戦略分野で桁違いの売上を置く場合は、量産歩留まり・顧客認証・資金の実行証拠が不可欠。,https://seichotoushi-hojo.jp/assets/pdf/koufu_3_4ji/outline_216.pdf,https://seichotoushi-hojo.jp/assets/pdf/koufu_3_4ji/outline_186.pdf,同一公募回・近い投資規模を抽出後、公開PDF本文を人手精査
P02,3次,中央製乳株式会社,至誠堂製薬株式会社,3次・事業費58～66億円・補助金15～16億円,66,58,15,16,54,68.2,,,24.2,63.7,6.3,7.5,124,110,139,140,2.3649,2.928,"生乳供給基盤の維持、新しいチルドカップ分野、年3,500万個能力、充填工程の要員30%削減・5人から1人以下を説明。",大手製薬OEM需要、15か国輸出、能力10倍、夜間無人運転、データインテグリティ対応、自己資本比率60%目標を説明。,同規模なら、顧客・輸出先・能力倍率・省人化・財務耐久性まで数値がつながる計画が強い。新市場型でも、受注見込みと単価・数量の積み上げを足すべき。,https://seichotoushi-hojo.jp/assets/pdf/koufu_3_4ji/outline_42.pdf,https://seichotoushi-hojo.jp/assets/pdf/koufu_3_4ji/outline_71.pdf,同一公募回・近い投資規模を抽出後、公開PDF本文を人手精査
P03,4次,フクビ岡山株式会社,株式会社キィポーション,4次・事業費約37億円・補助金約9億円,36.52,37,9,9.1,35.4,55.07,,32.84,23.4,36.5,6.2,6.5,40,90,60,146,1.6706,3.230894,断熱規制強化、グループ戦略、フェノール断熱材の供給能力増強、建築物の省エネ政策との整合を説明。,OEMから企画・設計・製造一貫のODMへの転換、5工場統合、FSSC、海外展開、複数顧客の受注、女性雇用を説明。,規制追い風だけでなく、顧客別受注、単価、設備能力、稼働率を結ぶと強い。単なる増産より、ODM化など利益率が変わる事業モデル転換が説明力を持つ。,https://seichotoushi-hojo.jp/assets/pdf/koufu_3_4ji/outline_192.pdf,https://seichotoushi-hojo.jp/assets/pdf/koufu_3_4ji/outline_127.pdf,同一公募回・近い投資規模を抽出後、公開PDF本文を人手精査
P04,3次,長野牛乳株式会社,栄屋乳業株式会社,3次・食品製造・大型新工場投資（事業費61～89億円）,89,61,22,20,99,200,,,28.9,38.5,6,8,40,30,49,130,0.7257,5.935,既存設備が能力上限、4ライン整備、能力2倍超、販路拡大、地域酪農の供給網維持を説明。,ニッチトップブランド、国内外の冷凍デザート、次世代冷凍技術、スマート工場と大幅雇用増を説明。,雇用増が小さくても、需要超過の解消と地域サプライチェーン維持という防衛的・基盤的効果は補完要因になる。数量×単価×稼働率の上限検証は必要。,https://seichotoushi-hojo.jp/assets/pdf/koufu_3_4ji/outline_87.pdf,https://seichotoushi-hojo.jp/assets/pdf/koufu_3_4ji/outline_173.pdf,同一公募回・近い投資規模を抽出後、公開PDF本文を人手精査
P05,4次,杉プラスチック工業株式会社,株式会社シー・エス・ケイ,4次・事業費17.7～20億円・補助金4.9～5.9億円,20,17.69,4.9,5.9,42.42,109,,30,26.3,26.5,6.6,7,106,123,112,168,1.39664,3.92691,PET・多品種対応、資源循環、顧客増産要請、スマートファクトリーを説明。,3工場2倉庫の統合、工程一貫自動化、国内回帰・インフラ需要、厚板・再エネ市場への展開、再教育を説明。,省力化率だけが近くても差はつく。統合で解消する制約、新市場への販売経路、売上増の選択肢の数を示すことが重要。,https://seichotoushi-hojo.jp/assets/pdf/koufu_3_4ji/outline_122.pdf,https://seichotoushi-hojo.jp/assets/pdf/koufu_3_4ji/outline_144.pdf,同一公募回・近い投資規模を抽出後、公開PDF本文を人手精査
